1.

mysql> create database sql_project;
Query OK, 1 row affected (0.83 sec)

mysql> use sql_project;
Database changed

mysql> create table deposit(
    -> actno varchar(25) PRIMARY KEY,
    -> cname varchar(20),
    -> bname varchar(20),
    -> amount int,
    -> adate date);
Query OK, 0 rows affected (0.64 sec)

mysql> create table branch(
    -> bname varchar(20) PRIMARY KEY,
    -> city varchar(20)
    -> );
Query OK, 0 rows affected (0.17 sec)

mysql> create table customer(
    -> cname varchar(20),
    -> city varchar(20)
    -> );
Query OK, 0 rows affected (0.14 sec)

mysql> alter table customer modify cname varchar(20) PRIMARY KEY;
Query OK, 0 rows affected (0.72 sec)
Records: 0  Duplicates: 0  Warnings: 0

mysql> create table borrow(
    -> loanno varchar(5) PRIMARY KEY,
    -> cname varchar(20),
    -> bname varchar(20),
    -> amount int
    -> );
Query OK, 0 rows affected (0.33 sec)

mysql> desc deposit;
+--------+-------------+------+-----+---------+-------+
| Field  | Type        | Null | Key | Default | Extra |
+--------+-------------+------+-----+---------+-------+
| actno  | varchar(25) | NO   | PRI | NULL    |       |
| cname  | varchar(20) | YES  |     | NULL    |       |
| bname  | varchar(20) | YES  |     | NULL    |       |
| amount | int         | YES  |     | NULL    |       |
| adate  | date        | YES  |     | NULL    |       |
+--------+-------------+------+-----+---------+-------+
5 rows in set (0.35 sec)


2.

mysql> desc customer;
+-------+-------------+------+-----+---------+-------+
| Field | Type        | Null | Key | Default | Extra |
+-------+-------------+------+-----+---------+-------+
| cname | varchar(20) | NO   | PRI | NULL    |       |
| city  | varchar(20) | YES  |     | NULL    |       |
+-------+-------------+------+-----+---------+-------+
2 rows in set (0.00 sec)

mysql> desc branch;
+-------+-------------+------+-----+---------+-------+
| Field | Type        | Null | Key | Default | Extra |
+-------+-------------+------+-----+---------+-------+
| bname | varchar(20) | NO   | PRI | NULL    |       |
| city  | varchar(20) | YES  |     | NULL    |       |
+-------+-------------+------+-----+---------+-------+
2 rows in set (0.00 sec)

mysql> desc borrow;
+--------+-------------+------+-----+---------+-------+
| Field  | Type        | Null | Key | Default | Extra |
+--------+-------------+------+-----+---------+-------+
| loanno | varchar(5)  | NO   | PRI | NULL    |       |
| cname  | varchar(20) | YES  |     | NULL    |       |
| bname  | varchar(20) | YES  |     | NULL    |       |
| amount | int         | YES  |     | NULL    |       |
+--------+-------------+------+-----+---------+-------+
4 rows in set (0.00 sec)


3.

mysql> SELECT * from deposit;
+-------+---------+-----------+--------+------------+
| actno | cname   | bname     | amount | adate      |
+-------+---------+-----------+--------+------------+
| 100   | ANIL    | VRCE      |   1000 | 1995-03-01 |
| 101   | SUNIL   | MGROAD    |   5000 | 1996-01-04 |
| 102   | RAHUL   | KAROLBAGH |   3500 | 1995-11-17 |
| 103   | MADHURI | CHANDNI   |   1200 | 1995-12-17 |
| 104   | PRAMOD  | MGROAD    |   3000 | 1996-03-27 |
| 105   | SANDIP  | KAROLBAGH |   2000 | 1996-03-31 |
+-------+---------+-----------+--------+------------+
6 rows in set (0.00 sec)


mysql> SELECT * FROM BRANCH;
+-----------+----------+
| bname     | city     |
+-----------+----------+
| CHANDNI   | DELHI    |
| KAROLBAGH | DELHI    |
| MGROAD    | BANGLORE |
| VRCE      | NAGPUR   |
+-----------+----------+
4 rows in set (0.00 sec)


mysql> SELECT * FROM CUSTOMER;
+---------+---------+
| cname   | city    |
+---------+---------+
| ANIL    | CALCUTA |
| MADHURI | NAGPUR  |
| PRAMOD  | NAGPUR  |
| RAHUL   | BARODA  |
| SUNIL   | DELHI   |
+---------+---------+
5 rows in set (0.00 sec)


mysql> SELECT * FROM BORROW;
+--------+---------+-----------+--------+
| loanno | cname   | bname     | amount |
+--------+---------+-----------+--------+
| 201    | ANIL    | VRCE      |   1000 |
| 206    | RAHUL   | KAROLBAGH |   5000 |
| 311    | SUNIL   | MGROAD    |   3000 |
| 321    | MADHURI | CHANDNI   |   2000 |
| 375    | PRAMOD  | MGROAD    |   8000 |
+--------+---------+-----------+--------+
5 rows in set (0.00 sec)

4.

mysql> select * from borrow where amount BETWEEN 2000 AND 3000;
+--------+---------+---------+--------+
| loanno | cname   | bname   | amount |
+--------+---------+---------+--------+
| 311    | SUNIL   | MGROAD  |   3000 |
| 321    | MADHURI | CHANDNI |   2000 |
+--------+---------+---------+--------+
2 rows in set (0.00 sec)

5.

mysql> select * from deposit;
+-------+---------+-----------+--------+------------+
| actno | cname   | bname     | amount | adate      |
+-------+---------+-----------+--------+------------+
| 100   | ANIL    | VRCE      |   1000 | 1995-03-01 |
| 101   | SUNIL   | MGROAD    |   5000 | 1996-01-04 |
| 102   | RAHUL   | KAROLBAGH |   3500 | 1995-11-17 |
| 103   | MADHURI | CHANDNI   |   1200 | 1995-12-17 |
| 104   | PRAMOD  | MGROAD    |   3000 | 1996-03-27 |
| 105   | SANDIP  | KAROLBAGH |   2000 | 1996-03-31 |
+-------+---------+-----------+--------+------------+
6 rows in set (0.00 sec)

6.

mysql> select cname, actno from deposit;
+---------+-------+
| cname   | actno |
+---------+-------+
| ANIL    | 100   |
| SUNIL   | 101   |
| RAHUL   | 102   |
| MADHURI | 103   |
| PRAMOD  | 104   |
| SANDIP  | 105   |
+---------+-------+
6 rows in set (0.00 sec)

7.

mysql> select cname from customer where city="NAGPUR";
+---------+
| cname   |
+---------+
| MADHURI |
| PRAMOD  |
+---------+
2 rows in set (0.00 sec)

8.

mysql> select cname from deposit where adate<"1995-11-17";
+-------+
| cname |
+-------+
| ANIL  |
+-------+
1 row in set (0.00 sec)

9.

mysql> select actno, amount from deposit where adate BETWEEN "1995-12-01" AND "1
996-06-01";
+-------+--------+
| actno | amount |
+-------+--------+
| 101   |   5000 |
| 103   |   1200 |
| 104   |   3000 |
| 105   |   2000 |
+-------+--------+
4 rows in set (0.00 sec)

10.

mysql> select * from deposit where cname LIKE "C%";
Empty set (0.00 sec)

11.

mysql> select * from borrow where cname LIKE "_U%";
+--------+-------+--------+--------+
| loanno | cname | bname  | amount |
+--------+-------+--------+--------+
| 311    | SUNIL | MGROAD |   3000 |
+--------+-------+--------+--------+
1 row in set (0.00 sec)

12.

mysql> select * from deposit where bname="CHANDNI" OR "MGROAD";
+-------+---------+---------+--------+------------+
| actno | cname   | bname   | amount | adate      |
+-------+---------+---------+--------+------------+
| 103   | MADHURI | CHANDNI |   1200 | 1995-12-17 |
+-------+---------+---------+--------+------------+
1 row in set, 1 warning (0.04 sec)

13.

mysql> select * from deposit where bname="CHANDNI" OR bname="MGROAD";
+-------+---------+---------+--------+------------+
| actno | cname   | bname   | amount | adate      |
+-------+---------+---------+--------+------------+
| 101   | SUNIL   | MGROAD  |   5000 | 1996-01-04 |
| 103   | MADHURI | CHANDNI |   1200 | 1995-12-17 |
| 104   | PRAMOD  | MGROAD  |   3000 | 1996-03-27 |
+-------+---------+---------+--------+------------+
3 rows in set (0.00 sec)

14.

mysql> select * from deposit where amount>1000 ORDER BY cname;
+-------+---------+-----------+--------+------------+
| actno | cname   | bname     | amount | adate      |
+-------+---------+-----------+--------+------------+
| 103   | MADHURI | CHANDNI   |   1200 | 1995-12-17 |
| 104   | PRAMOD  | MGROAD    |   3000 | 1996-03-27 |
| 102   | RAHUL   | KAROLBAGH |   3500 | 1995-11-17 |
| 105   | SANDIP  | KAROLBAGH |   2000 | 1996-03-31 |
| 101   | SUNIL   | MGROAD    |   5000 | 1996-01-04 |
+-------+---------+-----------+--------+------------+
5 rows in set (0.00 sec)

15.

mysql> select * from deposit where amount>1000 ORDER BY cname DESC;
+-------+---------+-----------+--------+------------+
| actno | cname   | bname     | amount | adate      |
+-------+---------+-----------+--------+------------+
| 101   | SUNIL   | MGROAD    |   5000 | 1996-01-04 |
| 105   | SANDIP  | KAROLBAGH |   2000 | 1996-03-31 |
| 102   | RAHUL   | KAROLBAGH |   3500 | 1995-11-17 |
| 104   | PRAMOD  | MGROAD    |   3000 | 1996-03-27 |
| 103   | MADHURI | CHANDNI   |   1200 | 1995-12-17 |
+-------+---------+-----------+--------+------------+
5 rows in set (0.00 sec)

16.

mysql> select * from borrow where cname LIKE "__A" OR cname LIKE "__D";
Empty set (0.00 sec)

17.

mysql> select * from borrow where amount NOT BETWEEN 2000 AND 8000;
+--------+-------+-------+--------+
| loanno | cname | bname | amount |
+--------+-------+-------+--------+
| 201    | ANIL  | VRCE  |   1000 |
+--------+-------+-------+--------+
1 row in set (0.00 sec)

18.

mysql> select DISTINCT * from deposit;
+-------+---------+-----------+--------+------------+
| actno | cname   | bname     | amount | adate      |
+-------+---------+-----------+--------+------------+
| 100   | ANIL    | VRCE      |   1000 | 1995-03-01 |
| 101   | SUNIL   | MGROAD    |   5000 | 1996-01-04 |
| 102   | RAHUL   | KAROLBAGH |   3500 | 1995-11-17 |
| 103   | MADHURI | CHANDNI   |   1200 | 1995-12-17 |
| 104   | PRAMOD  | MGROAD    |   3000 | 1996-03-27 |
| 105   | SANDIP  | KAROLBAGH |   2000 | 1996-03-31 |
+-------+---------+-----------+--------+------------+
6 rows in set (0.00 sec)

19.

mysql> update deposit set amount=amount+amount*0.1 where bname="VRCE";
Query OK, 1 row affected (0.09 sec)
Rows matched: 1  Changed: 1  Warnings: 0

mysql> select * from deposit;
+-------+---------+-----------+--------+------------+
| actno | cname   | bname     | amount | adate      |
+-------+---------+-----------+--------+------------+
| 100   | ANIL    | VRCE      |   1100 | 1995-03-01 |
| 101   | SUNIL   | MGROAD    |   5000 | 1996-01-04 |
| 102   | RAHUL   | KAROLBAGH |   3500 | 1995-11-17 |
| 103   | MADHURI | CHANDNI   |   1200 | 1995-12-17 |
| 104   | PRAMOD  | MGROAD    |   3000 | 1996-03-27 |
| 105   | SANDIP  | KAROLBAGH |   2000 | 1996-03-31 |
+-------+---------+-----------+--------+------------+
6 rows in set (0.00 sec)

20.

mysql> update deposit set amount=amount+amount*10 where bname="VRCE" AND cname="
ANIL";
Query OK, 1 row affected (0.07 sec)
Rows matched: 1  Changed: 1  Warnings: 0

mysql> select * from deposit;
+-------+---------+-----------+--------+------------+
| actno | cname   | bname     | amount | adate      |
+-------+---------+-----------+--------+------------+
| 100   | ANIL    | VRCE      |  12100 | 1995-03-01 |
| 101   | SUNIL   | MGROAD    |   5000 | 1996-01-04 |
| 102   | RAHUL   | KAROLBAGH |   3500 | 1995-11-17 |
| 103   | MADHURI | CHANDNI   |   1200 | 1995-12-17 |
| 104   | PRAMOD  | MGROAD    |   3000 | 1996-03-27 |
| 105   | SANDIP  | KAROLBAGH |   2000 | 1996-03-31 |
+-------+---------+-----------+--------+------------+
6 rows in set (0.00 sec)